{
  "$schema": "http://json-schema.org/draft-07/schema#",
  "$id": "https://example.org/schema/typeface.schema.json",
  "title": "Typeface",
  "description": "A typeface, digital or pre-digital.",
  "type": "object",
  "additionalProperties": false,
  "required": [
    "id",
    "slug",
    "name",
    "designers",
    "sources",
    "record_status",
    "created_at",
    "updated_at"
  ],
  "properties": {
    "id": {
      "type": "string",
      "pattern": "^rtd-t-[0-9]{6}$",
      "description": "Permanent opaque identifier. Never reused, never changed once assigned."
    },
    "slug": {
      "type": "string",
      "pattern": "^[a-z0-9]+(-[a-z0-9]+)*$"
    },
    "previous_slugs": {
      "type": "array",
      "items": { "type": "string", "pattern": "^[a-z0-9]+(-[a-z0-9]+)*$" },
      "default": [],
      "description": "Slugs this record used to have before being renamed. The build emits a redirect stub page at each old URL pointing at the current one, so old links keep working. Append the old slug here whenever you change `slug`, never remove an entry once added."
    },
    "name": {
      "type": "object",
      "additionalProperties": false,
      "required": ["preferred"],
      "properties": {
        "preferred": { "type": "string", "minLength": 1 },
        "alternates": {
          "type": "array",
          "items": { "type": "string", "minLength": 1 },
          "default": []
        },
        "native": {
          "type": "array",
          "items": {
            "type": "object",
            "additionalProperties": false,
            "required": ["value", "script"],
            "properties": {
              "value": { "type": "string", "minLength": 1 },
              "script": { "type": "string", "minLength": 1 },
              "language": { "type": "string", "pattern": "^[a-z]{2,3}(-[A-Za-z0-9]{2,8})*$" }
            }
          },
          "description": "The name written in its own script(s), as found in a source."
        }
      }
    },
    "designers": {
      "type": "array",
      "minItems": 0,
      "items": {
        "type": "object",
        "additionalProperties": false,
        "required": ["id", "role"],
        "properties": {
          "id": { "type": "string", "pattern": "^rtd-p-[0-9]{6}$" },
          "role": { "type": "string", "minLength": 1 }
        }
      },
      "description": "Points at person ids. The reverse ('typefaces by this person') is computed at build time, not hand-maintained on the person record. Empty only when no individual designer can be named - see `attribution`, required in that case (enforced by scripts/validate.js, not expressible in this schema alone)."
    },
    "attribution": {
      "type": "object",
      "additionalProperties": false,
      "required": ["note"],
      "properties": {
        "unknown": { "type": "boolean", "const": true, "description": "Older form of status: unknown. Still accepted." },
        "status": {
          "type": "string",
          "enum": ["unknown", "anonymous", "collective", "foundry-only", "lost"],
          "description": "Why no individual is credited: unknown, anonymous (deliberately uncredited), collective (made by a group or community), foundry-only (credited to the organisation), lost (records did not survive)."
        },
        "note": {
          "type": "string",
          "minLength": 1,
          "description": "Plain description of the attribution, e.g. \"Credited to the foundry's in-house team\"."
        }
      },
      "description": "Only set when designers is empty. Never set alongside a non-empty designers[] - enforced by scripts/validate.js."
    },
    "foundry": {
      "type": "array",
      "default": [],
      "items": {
        "type": "object",
        "additionalProperties": false,
        "required": ["name"],
        "properties": {
          "name": { "type": "string", "minLength": 1 },
          "url": { "type": "string", "format": "uri" },
          "id": { "type": "string", "pattern": "^rtd-o-[0-9]{6}$", "description": "The organisation record for this foundry, when there is one." }
        }
      }
    },
    "design_year": { "type": "string" },
    "release_year": { "type": "string" },
    "classification": { "type": "string" },
    "scripts": {
      "type": "array",
      "items": { "type": "string" },
      "default": []
    },
    "era": {
      "oneOf": [
        { "type": "string", "enum": ["digital", "metal", "phototype", "wood", "other"] },
        { "type": "array", "minItems": 1, "uniqueItems": true, "items": { "type": "string", "enum": ["digital", "metal", "phototype", "wood", "other"] } }
      ],
      "description": "Production technology. A list when the typeface exists in more than one, e.g. [\"metal\", \"digital\"]."
    },
    "languages": {
      "type": "array",
      "items": {
        "type": "object",
        "additionalProperties": false,
        "required": ["name"],
        "properties": {
          "name": { "type": "string", "minLength": 1 },
          "code": { "type": "string", "pattern": "^[a-z]{3}$", "description": "ISO 639-3 code." }
        }
      },
      "description": "Languages the typeface was made for or documented as supporting, as stated in a source. Separate from scripts."
    },
    "related_typefaces": {
      "type": "array",
      "items": {
        "type": "object",
        "additionalProperties": false,
        "required": ["id", "relation"],
        "properties": {
          "id": { "type": "string", "pattern": "^rtd-t-[0-9]{6}$" },
          "relation": { "type": "string", "enum": ["revival_of", "digitisation_of", "adaptation_of", "companion_to"] }
        }
      },
      "description": "This typeface's relation to another RTD typeface, e.g. {\"id\": \"rtd-t-000012\", \"relation\": \"digitisation_of\"}."
    },
    "commissioned_by": {
      "type": "array",
      "items": {
        "type": "object",
        "additionalProperties": false,
        "required": ["name"],
        "properties": {
          "name": { "type": "string", "minLength": 1 },
          "url": { "type": "string", "format": "uri" }
        }
      },
      "description": "Organisation(s) or person(s) that commissioned the typeface, only when a source states it."
    },
    "unicode_compliant": {
      "type": "boolean",
      "description": "False for digital fonts that map a script's glyphs onto non-standard code points (plain ASCII, PUA, or another script's block) instead of the script's real Unicode block, common in fonts made before a script was encoded. Omit when not established either way, don't assume true by default."
    },
    "license": {
      "type": "object",
      "additionalProperties": false,
      "required": ["status", "url"],
      "properties": {
        "status": {
          "type": "string",
          "enum": ["open", "proprietary", "public-domain", "unstated"],
          "description": "open: a free licence that allows redistribution and web embedding (OFL, Apache, UFL, GPL with font exception). proprietary: a commercial or restrictive licence. public-domain: dedicated to or fallen into the public domain. unstated: the font is distributed but no licence could be found."
        },
        "spdx": {
          "type": "string",
          "minLength": 1,
          "description": "SPDX licence identifier, e.g. OFL-1.1, Apache-2.0, UFL-1.0. Required when status is open (enforced by scripts/validate.js)."
        },
        "url": {
          "type": "string",
          "format": "uri",
          "description": "Where the licence for this typeface is stated, e.g. the OFL.txt in the font's repository or the foundry's licence page."
        }
      },
      "description": "Licence of the digital font. Decides whether the site may host the font file and render a live text sample: only open and public-domain fonts may be rendered live. Omit when not established, never guess."
    },
    "description": {
      "type": "string",
      "maxLength": 1000
    },
    "external_ids": {
      "type": "object",
      "additionalProperties": false,
      "properties": {
        "wikidata_qid": { "type": "string", "pattern": "^Q[0-9]+$" },
        "viaf": { "type": "string", "description": "VIAF cluster id, digits only." },
        "isni": { "type": "string", "description": "ISNI, 16 digits, spaces optional." },
        "lc_naf": { "type": "string", "description": "Library of Congress/NACO Authority File id." },
        "gnd": { "type": "string", "description": "GND (Gemeinsame Normdatei / Deutsche Nationalbibliothek) id." },
        "worldcat_entity": { "type": "string", "description": "OCLC WorldCat Entity id, the string after id.oclc.org/worldcat/entity/. Note: the WorldCat.org detail page for an entity currently prompts for a library-affiliated login to view, unlike the other authority files here, still worth recording as a cross-reference even though the page itself isn't always freely browsable." }
      },
      "description": "Informational cross-references only, one per authority file. Never usable as a sources entry."
    },
    "sources": {
      "type": "array",
      "items": {
        "type": "object",
        "additionalProperties": false,
        "required": ["url", "title"],
        "properties": {
          "url": { "type": "string", "format": "uri" },
          "title": { "type": "string", "minLength": 1 },
          "type": {
            "type": "string",
            "enum": ["book", "book chapter", "journal article", "thesis", "conference paper", "newspaper or magazine", "interview", "type specimen", "foundry or publisher page", "font catalogue", "designer website", "archive or museum record", "standards document", "reference website", "government document", "community publication", "audio or video", "software repository", "other"],
            "description": "What kind of document this is. Descriptive only."
          },
          "language": {
            "type": "string",
            "pattern": "^[a-z]{2,3}(-[A-Za-z0-9]{2,8})*$",
            "description": "Language of the source, as a BCP 47 tag (e.g. en, or, sat, hi, ar)."
          },
          "date": { "type": "string", "description": "Publication date as given by the source (YYYY, YYYY-MM or YYYY-MM-DD)." },
          "publisher": { "type": "string", "minLength": 1 },
          "archive_url": { "type": "string", "format": "uri", "description": "An archived copy of url, e.g. on web.archive.org." }
        }
      },
      "description": "Independent, verifiable sources. Must never be Wikidata, Wikipedia, or any Wikimedia project, enforced by scripts/validate.js."
    },
    "contributed_by": {
      "type": "array",
      "default": [],
      "items": {
        "type": "object",
        "additionalProperties": false,
        "required": ["name"],
        "properties": {
          "name": { "type": "string", "minLength": 1 },
          "type": { "type": "string", "enum": ["individual", "institution"], "default": "individual" },
          "url": { "type": "string", "format": "uri" },
          "username": { "type": "string", "minLength": 1, "description": "Account name, such as a GitHub login. Kept in the data; the site credits name." }
        }
      },
      "description": "Who submitted or substantially contributed this record's entry - distinct from the typeface's own designers[]. The first entry is treated as the record's citation author (see site-templates/shared.js buildCitations). Auto-filled for issue-form submissions with the submitter's public GitHub name, or their login if no name is public, plus their login as username; add by hand when opening a PR directly, see CONTRIBUTING.md. Also powers the /contributors/ page. Omit entirely for records researched and entered by the registry's own maintainers - the citation falls back to the default maintainer credit in that case."
    },
    "verification_status": {
      "type": "string",
      "enum": ["verified", "needs_verification"],
      "default": "verified",
      "description": "Set to needs_verification when sources are thin or low-confidence rather than omitting the record entirely. Absent/'verified' means sources are considered solid."
    },
    "record_status": {
      "type": "string",
      "enum": ["active", "merged", "deprecated"]
    },
    "superseded_by": {
      "type": ["string", "null"],
      "pattern": "^rtd-t-[0-9]{6}$"
    },
    "created_at": { "type": "string", "format": "date" },
    "updated_at": { "type": "string", "format": "date" }
  }
}
