{
  "id": "rtd-t-000160",
  "slug": "naatak-gurmukhi",
  "name": {
    "preferred": "Naatak Gurmukhi",
    "alternates": []
  },
  "designers": [
    { "id": "rtd-p-000136", "role": "designer" }
  ],
  "foundry": [
    { "name": "Ek Type", "id": "rtd-o-000010", "url": "https://ektype.in" }
  ],
  "scripts": ["Gurmukhi"],
  "era": "digital",
  "description": "The Gurmukhi member of Naatak, an informal, retro-inspired uniwidth type family influenced by local street lettering and handwritten comics.",
  "sources": [
    { "url": "https://fontstand.com/fonts/naatak-gurmukhi", "title": "Naatak Gurmukhi - Fontstand", "type": "font catalogue", "publisher": "Fontstand", "archive_url": "https://web.archive.org/web/20240911042653/https://fontstand.com/fonts/naatak-gurmukhi" }
  ],
  "record_status": "active",
  "superseded_by": null,
  "created_at": "2026-08-19",
  "updated_at": "2026-10-19"
}
