{
  "id": "rtd-t-000059",
  "external_ids": { "wikidata_qid": "Q505337" },
  "slug": "avenir-next",
  "name": {
    "preferred": "Avenir Next",
    "alternates": []
  },
  "designers": [
    {
      "id": "rtd-p-000061",
      "role": "type designer"
    },
    {
      "id": "rtd-p-000062",
      "role": "type designer"
    }
  ],
  "scripts": [],
  "sources": [
    {
      "url": "http://www.linotype.com/fontdesigners",
      "title": "www.linotype.com",
      "type": "foundry or publisher page",
      "publisher": "Linotype"
    },
    {
      "url": "http://www.linotype.com",
      "title": "www.linotype.com",
      "type": "foundry or publisher page",
      "publisher": "Linotype"
    }
  ],
  "record_status": "active",
  "superseded_by": null,
  "created_at": "2026-08-07",
  "updated_at": "2026-10-08",
  "verification_status": "needs_verification"
}
