{
  "id": "rtd-t-000142",
  "external_ids": { "wikidata_qid": "Q23777415" },
  "slug": "arnhem-pro",
  "name": {
    "preferred": "Arnhem",
    "alternates": ["Arnhem Pro"]
  },
  "designers": [
    {
      "id": "rtd-p-000119",
      "role": "type designer"
    }
  ],
  "foundry": [
    {
      "name": "OurType", "id": "rtd-o-000029",
      "url": "https://typecache.com/OurType/"
    }
  ],
  "release_year": "2002",
  "classification": "Serif",
  "scripts": ["Latin"],
  "era": "digital",
  "description": "A text family designed over several years for the official daily newspaper of the Dutch government.",
  "sources": [
    {
      "url": "https://ilovetypography.com/2008/02/14/typeface-review-arnhem/",
      "title": "Typeface Review: Arnhem - I Love Typography",
      "type": "newspaper or magazine",
      "publisher": "I Love Typography",
      "archive_url": "https://web.archive.org/web/20260823190956/https://ilovetypography.com/2008/02/14/typeface-review-arnhem/"
    },
    {
      "url": "https://eyemagazine.com/feature/article/reputations-fred-smeijers",
      "title": "Reputations: Fred Smeijers - Eye Magazine",
      "type": "newspaper or magazine",
      "publisher": "Eye",
      "archive_url": "https://web.archive.org/web/20260811032818/https://eyemagazine.com/feature/article/reputations-fred-smeijers"
    }
  ],
  "record_status": "active",
  "superseded_by": null,
  "created_at": "2026-08-10",
  "updated_at": "2026-10-19"
}
