{
  "id": "rtd-t-000134",
  "slug": "muktamahee-medium",
  "name": {
    "preferred": "MuktaMahee Medium",
    "alternates": []
  },
  "designers": [
    {
      "id": "rtd-p-000114",
      "role": "type designer"
    }
  ],
  "scripts": [],
  "sources": [
    {
      "url": "http://www.ektype.in",
      "title": "www.ektype.in",
      "type": "foundry or publisher page",
      "publisher": "Ek Type"
    }
  ],
  "record_status": "active",
  "superseded_by": null,
  "created_at": "2026-08-07",
  "updated_at": "2026-10-08",
  "verification_status": "needs_verification"
}
