{
  "id": "rtd-t-000012",
  "slug": "lini",
  "name": {
    "preferred": "Lini",
    "alternates": []
  },
  "designers": [
    { "id": "rtd-p-000013", "role": "designer" }
  ],
  "era": "digital",
  "description": "A typeface awarded a Certificate of Excellence by the Type Directors Club (TDC67).",
  "sources": [
    { "url": "https://tdc.org/work/kimya-gandhi/", "title": "Kimya Gandhi - The Type Directors Club", "type": "foundry or publisher page", "publisher": "Type Directors Club" }
  ],
  "record_status": "active",
  "superseded_by": null,
  "created_at": "2026-08-05",
  "updated_at": "2026-10-08"
}
