{
  "id": "rtd-t-000183",
  "slug": "pakeezah",
  "name": { "preferred": "Pakeezah", "alternates": ["Pakeezah Series", "Pakeezah No. 3"] },
  "designers": [],
  "attribution": { "status": "foundry-only", "note": "No designer is named in the sources." },
  "foundry": [{ "name": "Diamond Wooden Type Works", "id": "rtd-o-000040" }],
  "design_year": "c. 1975",
  "scripts": ["Latin"],
  "era": "wood",
  "description": "Latin wood display type whose outline mimics overlapping wooden planks. The only Latin face in the Diamond Wooden Type Works specimens with an Urdu name, meaning pure.",
  "sources": [
    { "url": "https://letterformarchive.org/news/diamond-wooden-type-works/", "title": "This Just In: Diamond Wooden Type Works (Tanya George) - Letterform Archive", "type": "archive or museum record", "publisher": "Letterform Archive", "date": "2024-07-08", "archive_url": "https://web.archive.org/web/20260511000125/https://letterformarchive.org/news/diamond-wooden-type-works/" }
  ],
  "record_status": "active",
  "superseded_by": null,
  "created_at": "2026-10-27",
  "updated_at": "2026-10-27"
}
