{
  "id": "rtd-t-000087",
  "external_ids": { "wikidata_qid": "Q768857" },
  "slug": "baskerville",
  "name": {
    "preferred": "Baskerville",
    "alternates": []
  },
  "designers": [
    {
      "id": "rtd-p-000080",
      "role": "type designer"
    }
  ],
  "scripts": [],
  "sources": [
    {
      "url": "http://www.agfamonotype.com/html/designer/des_index.html",
      "title": "www.agfamonotype.com",
      "type": "foundry or publisher page",
      "publisher": "Agfa Monotype"
    },
    {
      "url": "http://www.agfamonotype.com",
      "title": "www.agfamonotype.com",
      "type": "foundry or publisher page",
      "publisher": "Agfa Monotype"
    }
  ],
  "record_status": "active",
  "superseded_by": null,
  "created_at": "2026-08-07",
  "updated_at": "2026-10-08",
  "verification_status": "needs_verification"
}
