{
  "id": "rtd-t-000065",
  "external_ids": { "wikidata_qid": "Q31841881" },
  "slug": "acier",
  "name": {
    "preferred": "Acier",
    "alternates": []
  },
  "designers": [
    {
      "id": "rtd-p-000067",
      "role": "type designer"
    }
  ],
  "scripts": [],
  "sources": [],
  "record_status": "active",
  "superseded_by": null,
  "created_at": "2026-08-07",
  "updated_at": "2026-08-07",
  "verification_status": "needs_verification"
}
