{
  "id": "rtd-t-000180",
  "slug": "mangal",
  "name": { "preferred": "Mangal", "alternates": [] },
  "designers": [
    { "id": "rtd-p-000043", "role": "designer" }
  ],
  "foundry": [{ "name": "Microsoft", "id": "rtd-o-000021" }],
  "scripts": ["Devanagari"],
  "era": "digital",
  "license": { "status": "proprietary", "url": "https://learn.microsoft.com/en-us/typography/fonts/font-faq" },
  "description": "Devanagari OpenType UI font for Microsoft Windows, designed by R K Joshi. Awarded a Bukva:raz! prize.",
  "sources": [
    { "url": "https://learn.microsoft.com/en-us/typography/font-list/mangal", "title": "Mangal font family - Typography | Microsoft Learn", "type": "foundry or publisher page", "publisher": "Microsoft", "archive_url": "https://web.archive.org/web/20260926142220/https://learn.microsoft.com/en-us/typography/font-list/mangal" },
    { "url": "https://letterformarchive.org/news/the-multilinguascriptic-life-of-r-k-joshi/", "title": "The Multilinguascriptic Life of R. K. Joshi - Letterform Archive", "type": "archive or museum record", "publisher": "Letterform Archive", "date": "2023-11-28", "archive_url": "https://web.archive.org/web/20260609051310/https://letterformarchive.org/news/the-multilinguascriptic-life-of-r-k-joshi/" }
  ],
  "record_status": "active",
  "superseded_by": null,
  "created_at": "2026-10-19",
  "updated_at": "2026-10-19"
}
