{
  "id": "rtd-t-000070",
  "external_ids": { "wikidata_qid": "Q122203073" },
  "slug": "vercetti-regular",
  "name": {
    "preferred": "Vercetti Regular",
    "alternates": []
  },
  "designers": [
    {
      "id": "rtd-p-000071",
      "role": "type designer"
    },
    {
      "id": "rtd-p-000101",
      "role": "type designer"
    }
  ],
  "scripts": ["Latin"],
  "sources": [
    {
      "url": "https://argolika.gr/2024/05/23/i-grammatoseira-toy-grafista-fillippoy-fragogianni",
      "title": "Η γραμματοσειρά του γραφίστα Φίλιππου Φραγκογιάννη κερδίζει βραβεία",
      "archive_url": "https://web.archive.org/web/20260515110452/https://argolika.gr/2024/05/23/i-grammatoseira-toy-grafista-fillippoy-fragogianni"
    },
    {
      "url": "https://atypeofamigo.com/inspiration/vercetti-is-a-treasure-found-in-the-free-fonts-world",
      "title": "Vercetti font: A treasure found in the typography universe",
      "archive_url": "https://web.archive.org/web/20241202111632/https://atypeofamigo.com/inspiration/vercetti-is-a-treasure-found-in-the-free-fonts-world"
    },
    {
      "url": "https://filipposfragkogiannis.com/fonts/vercetti-regular/",
      "title": "filipposfragkogiannis.com",
      "type": "designer website",
      "archive_url": "https://web.archive.org/web/20260609172615/https://filipposfragkogiannis.com/fonts/vercetti-regular/"
    }
  ],
  "record_status": "active",
  "superseded_by": null,
  "created_at": "2026-08-07",
  "updated_at": "2026-10-08",
  "verification_status": "needs_verification"
}
