{
  "id": "rtd-t-000055",
  "slug": "akhand-odia",
  "name": {
    "preferred": "Akhand Odia",
    "alternates": []
  },
  "designers": [
    { "id": "rtd-p-000009", "role": "designer" }
  ],
  "foundry": [
    { "name": "Indian Type Foundry", "id": "rtd-o-000017", "url": "https://www.indiantypefoundry.com" }
  ],
  "scripts": ["Odia"],
  "release_year": "2018",
  "era": "digital",
  "description": "A sans-serif Odia typeface by Jyotish Sonowal, released by the Indian Type Foundry.",
  "external_ids": { "wikidata_qid": "Q125400371" },
  "sources": [
    { "url": "https://www.indiantypefoundry.com/designers/jyotish-sonowal", "title": "Jyotish Sonowal - Indian Type Foundry", "type": "foundry or publisher page", "publisher": "Indian Type Foundry", "archive_url": "https://web.archive.org/web/20191014003536/https://www.indiantypefoundry.com/designers/jyotish-sonowal" }
  ],
  "record_status": "active",
  "superseded_by": null,
  "created_at": "2026-08-07",
  "updated_at": "2026-10-19"
}
