{
  "id": "rtd-t-000097",
  "slug": "georgia",
  "name": {
    "preferred": "Georgia",
    "alternates": []
  },
  "designers": [
    {
      "id": "rtd-p-000089",
      "role": "type designer"
    }
  ],
  "scripts": [],
  "sources": [],
  "record_status": "active",
  "superseded_by": null,
  "created_at": "2026-08-07",
  "updated_at": "2026-08-07",
  "verification_status": "needs_verification"
}
