{
  "id": "rtd-t-000130",
  "external_ids": { "wikidata_qid": "Q1631297" },
  "slug": "trebuchet-ms",
  "name": {
    "preferred": "Trebuchet MS",
    "alternates": []
  },
  "designers": [
    {
      "id": "rtd-p-000112",
      "role": "type designer"
    }
  ],
  "scripts": [],
  "sources": [
    {
      "url": "http://www.microsoft.com/typography/",
      "title": "www.microsoft.com",
      "type": "foundry or publisher page",
      "publisher": "Microsoft",
      "archive_url": "https://web.archive.org/web/20230513234543/http://www.microsoft.com/typography/"
    },
    {
      "url": "http://www.microsoft.com",
      "title": "www.microsoft.com",
      "type": "foundry or publisher page",
      "publisher": "Microsoft",
      "archive_url": "https://web.archive.org/web/20261006193403/http://www.microsoft.com"
    }
  ],
  "record_status": "active",
  "superseded_by": null,
  "created_at": "2026-08-07",
  "updated_at": "2026-10-08",
  "verification_status": "needs_verification"
}
