{
  "id": "rtd-t-000162",
  "slug": "october-devanagari-tamil",
  "name": {
    "preferred": "October (Devanagari and Tamil)",
    "alternates": []
  },
  "designers": [
    { "id": "rtd-p-000137", "role": "designer" }
  ],
  "foundry": [
    { "name": "Typotheque", "id": "rtd-o-000035", "url": "https://www.typotheque.com/authors/arya-purohit" }
  ],
  "scripts": ["Devanagari", "Tamil"],
  "era": "digital",
  "description": "The Devanagari and Tamil versions of Typotheque's October type family, designed by Arya Purohit.",
  "sources": [
    { "url": "https://www.typotheque.com/blog/november-october-support-extended-to-devanagari-and-tamil", "title": "November / October support extended to Devanagari and Tamil - Typotheque", "type": "foundry or publisher page", "publisher": "Typotheque", "archive_url": "https://web.archive.org/web/20250831005822/https://www.typotheque.com/blog/november-october-support-extended-to-devanagari-and-tamil" }
  ],
  "record_status": "active",
  "superseded_by": null,
  "created_at": "2026-08-19",
  "updated_at": "2026-10-19"
}
