{
  "id": "rtd-t-000071",
  "external_ids": { "wikidata_qid": "Q23893723" },
  "slug": "birka",
  "name": {
    "preferred": "Birka",
    "alternates": []
  },
  "designers": [
    {
      "id": "rtd-p-000072",
      "role": "type designer"
    }
  ],
  "scripts": [],
  "sources": [
    {
      "url": "https://www.linotype.com/162/birka-family.html",
      "title": "www.linotype.com",
      "type": "foundry or publisher page",
      "publisher": "Linotype",
      "archive_url": "https://web.archive.org/web/20240302224528/https://www.linotype.com/162/birka-family.html"
    }
  ],
  "record_status": "active",
  "superseded_by": null,
  "created_at": "2026-08-07",
  "updated_at": "2026-10-08",
  "verification_status": "needs_verification"
}
