{
  "id": "rtd-t-000058",
  "external_ids": { "wikidata_qid": "Q21296411" },
  "slug": "ondine-script",
  "name": {
    "preferred": "Ondine Script",
    "alternates": []
  },
  "designers": [
    {
      "id": "rtd-p-000061",
      "role": "type designer"
    }
  ],
  "scripts": [],
  "sources": [],
  "record_status": "active",
  "superseded_by": null,
  "created_at": "2026-08-07",
  "updated_at": "2026-08-07",
  "verification_status": "needs_verification"
}
