{
  "id": "rtd-t-000078",
  "external_ids": { "wikidata_qid": "Q130569348" },
  "slug": "alt-klarinet",
  "name": {
    "preferred": "ALT Klarinet",
    "alternates": []
  },
  "designers": [
    {
      "id": "rtd-p-000074",
      "role": "type designer"
    }
  ],
  "scripts": ["Latin"],
  "sources": [],
  "record_status": "active",
  "superseded_by": null,
  "created_at": "2026-08-07",
  "updated_at": "2026-10-07",
  "verification_status": "needs_verification"
}
