{
  "id": "rtd-t-000105",
  "external_ids": { "wikidata_qid": "Q125338248" },
  "slug": "solare",
  "name": {
    "preferred": "Solare",
    "alternates": []
  },
  "designers": [
    {
      "id": "rtd-p-000094",
      "role": "type designer"
    }
  ],
  "scripts": ["Latin"],
  "sources": [
    {
      "url": "https://casadisolare.com",
      "title": "casadisolare.com"
    }
  ],
  "record_status": "active",
  "superseded_by": null,
  "created_at": "2026-08-07",
  "updated_at": "2026-10-07",
  "verification_status": "needs_verification"
}
